https://cdn.pacdora.com/image-resize/300xauto_outside/preview/mockup-150010.jpg,https://cdn.pacdora.com/image-resize/300xauto_outside/preview/dieline-150010.png,Custom Dimensions Flip Top Boxes Mailer Dieline 150010
https://cdn.pacdora.com/image-resize/300xauto_outside/preview/mockup-100010.jpg,https://cdn.pacdora.com/image-resize/300xauto_outside/preview/dieline-100010.png,Custom Dimensions Tuck End Boxes Double Tray Dieline 100010
https://cdn.pacdora.com/image-resize/300xauto_outside/preview/mockup-200010.jpg,https://cdn.pacdora.com/image-resize/300xauto_outside/preview/dieline-200010.png,Custom Dimensions Cartons 0201 Dieline 200010
https://cdn.pacdora.com/image-resize/300xauto_outside/preview/mockup-220010.jpg,https://cdn.pacdora.com/image-resize/300xauto_outside/preview/dieline-220010.png,Custom Dimensions Tote Bags Craft Paper Dieline 220010
https://cdn.pacdora.com/image-resize/300xauto_outside/preview/mockup-150011.jpg,https://cdn.pacdora.com/image-resize/300xauto_outside/preview/dieline-150011.png,Custom Dimensions Flip Top Boxes Mailer Dieline 150011
https://cdn.pacdora.com/image-resize/300xauto_outside/preview/mockup-100030.jpg,https://cdn.pacdora.com/image-resize/300xauto_outside/preview/dieline-100030.png,Custom Dimensions Reverse Straight Tuck End Boxes Double Tray Dieline 100030
https://cdn.pacdora.com/image-resize/300xauto_outside/preview/mockup-102010.jpg,https://cdn.pacdora.com/image-resize/300xauto_outside/preview/dieline-102010.png,Custom Dimensions Tuck End Boxes Auto Bottome Snap Lock Dieline 102010
https://cdn.pacdora.com/image-resize/300xauto_outside/preview/mockup-103013.jpg,https://cdn.pacdora.com/image-resize/300xauto_outside/preview/dieline-103013.png,Custom Dimensions Back Open Boxes Window Display Dieline 103013
https://cdn.pacdora.com/image-resize/300xauto_outside/preview/mockup-102615.jpg,https://cdn.pacdora.com/image-resize/300xauto_outside/preview/dieline-102615.png,Custom Dimensions Tuck End Boxes Lock Insert Dieline 102615
https://cdn.pacdora.com/image-resize/300xauto_outside/preview/mockup-100013.jpg,https://cdn.pacdora.com/image-resize/300xauto_outside/preview/dieline-100013.png,Custom Dimensions Tuck End Boxes Double Tray Dieline 100013
https://cdn.pacdora.com/image-resize/300xauto_outside/preview/mockup-150040.jpg,https://cdn.pacdora.com/image-resize/300xauto_outside/preview/dieline-150040.png,Custom Dimensions Magnet Box Flip Top Boxes Dieline 150040
https://cdn.pacdora.com/image-resize/300xauto_outside/preview/mockup-160010.jpg,https://cdn.pacdora.com/image-resize/300xauto_outside/preview/dieline-160010.png,Custom Dimensions Boxes with Lid Corrugated Shoe Dieline 160010
https://cdn.pacdora.com/image-resize/300xauto_outside/preview/mockup-102011.jpg,https://cdn.pacdora.com/image-resize/300xauto_outside/preview/dieline-102011.png,Custom Dimensions Tuck End Boxes Auto Bottome Snap Lock Dieline 102011
https://cdn.pacdora.com/image-resize/300xauto_outside/preview/mockup-102040.jpg,https://cdn.pacdora.com/image-resize/300xauto_outside/preview/dieline-102040.png,Custom Dimensions Auto Bottome Snap Lock Boxes 3-lock Bottom Dieline 102040
https://cdn.pacdora.com/image-resize/300xauto_outside/preview/mockup-150012.jpg,https://cdn.pacdora.com/image-resize/300xauto_outside/preview/dieline-150012.png,Custom Dimensions Flip Top Boxes Nail Buckles Dieline 150012
https://cdn.pacdora.com/image-resize/300xauto_outside/preview/mockup-246020.jpg,https://cdn.pacdora.com/image-resize/300xauto_outside/preview/dieline-246020.png,Custom Dimensions Folders Lock Multi-folders Dieline 246020
https://cdn.pacdora.com/image-resize/300xauto_outside/preview/mockup-220040.jpg,https://cdn.pacdora.com/image-resize/300xauto_outside/preview/dieline-220040.png,Custom Dimensions Tote Bags Hands-free Dieline 220040
https://cdn.pacdora.com/image-resize/300xauto_outside/preview/mockup-128030.jpg,https://cdn.pacdora.com/image-resize/300xauto_outside/preview/dieline-128030.png,Custom Dimensions Sleeve Box Tray Boxes Dieline 128030
https://cdn.pacdora.com/image-resize/300xauto_outside/preview/mockup-112310.jpg,https://cdn.pacdora.com/image-resize/300xauto_outside/preview/dieline-112310.png,Custom Dimensions Tuck End Box Variations Auto Bottome Snap Lock Boxes Dieline 112310
https://cdn.pacdora.com/image-resize/300xauto_outside/preview/mockup-103012.jpg,https://cdn.pacdora.com/image-resize/300xauto_outside/preview/dieline-103012.png,Custom Dimensions Back Open Boxes Auto Bottome Snap Lock Dieline 103012
https://cdn.pacdora.com/image-resize/300xauto_outside/preview/mockup-247030.jpg,https://cdn.pacdora.com/image-resize/300xauto_outside/preview/dieline-247030.png,Custom Dimensions Envelopes Interlocking Buckles Dieline 247030
https://cdn.pacdora.com/image-resize/300xauto_outside/preview/mockup-112320.jpg,https://cdn.pacdora.com/image-resize/300xauto_outside/preview/dieline-112320.png,Custom Dimensions Gable Box Tuck End Box With Handle Dieline 112320
https://cdn.pacdora.com/image-resize/300xauto_outside/preview/mockup-150020.jpg,https://cdn.pacdora.com/image-resize/300xauto_outside/preview/dieline-150020.png,Custom Dimensions Mailer Boxes Flip Top Dieline 150020
https://cdn.pacdora.com/image-resize/300xauto_outside/render/20210427/71c41993-61de-4941-99d5-5876150f0dc10001.jpg,https://cdn.pacdora.com/image-resize/300xauto_outside/preview/dieline-600040.png,Custom Dimensions Flexible Packaging Stand Up Zipper Pouches Dieline 600040
https://yun.baoxiaohe.com/render/20220209/17431140001.jpg?imageView2/2/w/300|imageslim,https://cdn.pacdora.com/image-resize/300xauto_outside/preview/dieline-500010.png,Cans Aluminum Bottles Tin Dieline 500010
https://cdn.pacdora.com/image-resize/300xauto_outside/preview/mockup-160011.jpg,https://cdn.pacdora.com/image-resize/300xauto_outside/preview/dieline-160011.png,Custom Dimensions Corrugated Boxes with Lid Dieline 160011
https://cdn.pacdora.com/image-resize/300xauto_outside/preview/mockup-160160.jpg,https://cdn.pacdora.com/image-resize/300xauto_outside/preview/dieline-160160.png,Custom Dimensions Boxes with Lid Four Folds Dieline 160160
https://cdn.pacdora.com/image-resize/300xauto_outside/preview/mockup-200020.jpg,https://cdn.pacdora.com/image-resize/300xauto_outside/preview/dieline-200020.png,Custom Dimensions Cartons 0202 Dieline 200020
https://cdn.pacdora.com/image-resize/300xauto_outside/render/20220210/17446940001.jpg,https://cdn.pacdora.com/image-resize/300xauto_outside/preview/dieline-600060.png,Flexible Packaging Paper Bags Stand Up Pouches Dieline 600060
https://cdn.pacdora.com/image-resize/300xauto_outside/preview/mockup-128020.jpg,https://cdn.pacdora.com/image-resize/300xauto_outside/preview/dieline-128020.png,Custom Dimensions Tray Boxes Paper Dieline 128020
https://cdn.pacdora.com/image-resize/300xauto_outside/preview/mockup-102680.jpg,https://cdn.pacdora.com/image-resize/300xauto_outside/preview/dieline-102680.png,Custom Dimensions Tuck End Boxes Back Open Dieline 102680
https://cdn.pacdora.com/image-resize/300xauto_outside/preview/mockup-248090.jpg,https://cdn.pacdora.com/image-resize/300xauto_outside/preview/dieline-248090.png,Custom Dimensions Envelopes Buckle Dieline 248090
https://cdn.pacdora.com/image-resize/300xauto_outside/preview/mockup-102020.jpg,https://cdn.pacdora.com/image-resize/300xauto_outside/preview/dieline-102020.png,Custom Dimensions Tuck End Boxes Auto Bottome Snap Lock Dieline 102020
https://yun.baoxiaohe.com/render/20220322/19782730001.jpg?imageView2/2/w/300|imageslim,https://cdn.pacdora.com/image-resize/300xauto_outside/preview/dieline-600700.png,Standing Pouch Bag Packaging Flexible Packaging Dieline 600700
https://cdn.pacdora.com/image-resize/300xauto_outside/preview/mockup-156210.jpg,https://cdn.pacdora.com/image-resize/300xauto_outside/preview/dieline-156210.png,Custom Dimensions Flip Top Boxes Pizza Dieline 156210
https://cdn.pacdora.com/image-resize/300xauto_outside/preview/mockup-180070.jpg,https://cdn.pacdora.com/image-resize/300xauto_outside/preview/dieline-180070.png,Custom Dimensions Trapezoid Shape Business Card Boxes Dieline 180070
https://cdn.pacdora.com/image-resize/300xauto_outside/preview/mockup-151010.jpg,https://cdn.pacdora.com/image-resize/300xauto_outside/preview/dieline-151010.png,Custom Dimensions Hexagonal Flip Top Boxes Flip Top Dieline 151010
https://cdn.pacdora.com/image-resize/300xauto_outside/preview/mockup-310140.jpg,https://cdn.pacdora.com/image-resize/300xauto_outside/preview/dieline-310140.png,Custom Dimensions Inserts/Dividers Supports Dieline 310140
https://cdn.pacdora.com/image-resize/300xauto_outside/preview/mockup-160020.jpg,https://cdn.pacdora.com/image-resize/300xauto_outside/preview/dieline-160020.png,Custom Dimensions Boxes with Lid Hoarding Cartons Dieline 160020
https://cdn.pacdora.com/image-resize/300xauto_outside/preview/mockup-161014.jpg,https://cdn.pacdora.com/image-resize/300xauto_outside/preview/dieline-161014.png,Custom Dimensions Boxes with Lid Double Ears Dieline 161014
https://cdn.pacdora.com/image-resize/300xauto_outside/preview/mockup-151110.jpg,https://cdn.pacdora.com/image-resize/300xauto_outside/preview/dieline-151110.png,Custom Dimensions Double Open Clamshell Boxes Flip Top Dieline 151110
https://cdn.pacdora.com/image-resize/300xauto_outside/preview/mockup-102610.jpg,https://cdn.pacdora.com/image-resize/300xauto_outside/preview/dieline-102610.png,Custom Dimensions Back Open Boxes Double Tray Dieline 102610
https://cdn.pacdora.com/image-resize/300xauto_outside/preview/mockup-100031.jpg,https://cdn.pacdora.com/image-resize/300xauto_outside/preview/dieline-100031.png,Custom Dimensions In-line Boxes Indentation in-line box Dieline 100031
https://cdn.pacdora.com/image-resize/300xauto_outside/preview/mockup-156260.jpg,https://cdn.pacdora.com/image-resize/300xauto_outside/preview/dieline-156260.png,Custom Dimensions Flip Top Boxes Folio Dieline 156260
https://cdn.pacdora.com/image-resize/300xauto_outside/preview/mockup-106031.jpg,https://cdn.pacdora.com/image-resize/300xauto_outside/preview/dieline-106031.png,Custom Dimensions Tuck End Boxes Auto Lock Bottom Dieline 106031
https://cdn.pacdora.com/image-resize/300xauto_outside/preview/mockup-310012.jpg,https://cdn.pacdora.com/image-resize/300xauto_outside/preview/dieline-310012.png,Custom Dimensions Inserts Square Hole Inserts Dieline 310012
https://cdn.pacdora.com/image-resize/300xauto_outside/preview/mockup-112311.jpg,https://cdn.pacdora.com/image-resize/300xauto_outside/preview/dieline-112311.png,Custom Dimensions Gable Box Tuck End Box Variations Dieline 112311
https://cdn.pacdora.com/image-resize/300xauto_outside/preview/mockup-105010.jpg,https://cdn.pacdora.com/image-resize/300xauto_outside/preview/dieline-105010.png,Custom Dimensions Auto Lock Bottom Boxes Business Card Dieline 105010
https://cdn.pacdora.com/image-resize/300xauto_outside/preview/mockup-156111.jpg,https://cdn.pacdora.com/image-resize/300xauto_outside/preview/dieline-156111.png,Custom Dimensions Flip Top Boxes Safety Buckle Double Mortise Lock Flip Dieline 156111
https://cdn.pacdora.com/image-resize/300xauto_outside/preview/mockup-200012.jpg,https://cdn.pacdora.com/image-resize/300xauto_outside/preview/dieline-200012.png,Custom Dimensions Cartons Moving Dieline 200012
https://cdn.pacdora.com/image-resize/300xauto_outside/preview/mockup-100032.jpg,https://cdn.pacdora.com/image-resize/300xauto_outside/preview/dieline-100032.png,Custom Dimensions Lock Insert Boxes Tuck End Dieline 100032
https://cdn.pacdora.com/image-resize/300xauto_outside/preview/mockup-171210.jpg,https://cdn.pacdora.com/image-resize/300xauto_outside/preview/dieline-171210.png,Custom Dimensions Display Boxes/Stands Six Grids Dieline 171210
https://cdn.pacdora.com/image-resize/300xauto_outside/preview/mockup-102012.jpg,https://cdn.pacdora.com/image-resize/300xauto_outside/preview/dieline-102012.png,Custom Dimensions Tuck End Boxes Auto Bottome Snap Lock Dieline 102012
https://cdn.pacdora.com/image-resize/300xauto_outside/preview/mockup-108001.jpg,https://cdn.pacdora.com/image-resize/300xauto_outside/preview/dieline-108001.png,Custom Dimensions Tuck End Boxes Paper Dieline 108001
https://cdn.pacdora.com/image-resize/300xauto_outside/preview/mockup-110051.jpg,https://cdn.pacdora.com/image-resize/300xauto_outside/preview/dieline-110051.png,Custom Dimensions Tuck End Box Variations With Window Dieline 110051
https://cdn.pacdora.com/image-resize/300xauto_outside/render/20220209/17428160001.jpg,https://cdn.pacdora.com/image-resize/300xauto_outside/preview/dieline-500340.png,Plastic Bottles Product Label Dieline 500340
https://cdn.pacdora.com/image-resize/300xauto_outside/preview/mockup-152080.jpg,https://cdn.pacdora.com/image-resize/300xauto_outside/preview/dieline-152080.png,Custom Dimensions Flip Top Boxes Easy Flip Covers Dieline 152080
https://cdn.pacdora.com/image-resize/300xauto_outside/preview/mockup-176030.jpg,https://cdn.pacdora.com/image-resize/300xauto_outside/preview/dieline-176030.png,Custom Dimensions Display Boxes/Stands Dieline 176030
https://cdn.pacdora.com/image-resize/300xauto_outside/preview/mockup-150170.jpg,https://cdn.pacdora.com/image-resize/300xauto_outside/preview/dieline-150170.png,Custom Dimensions Flip Top Boxes Rectangular Inserts Dieline 150170
https://cdn.pacdora.com/image-resize/300xauto_outside/preview/mockup-171380.jpg,https://cdn.pacdora.com/image-resize/300xauto_outside/preview/dieline-171380.png,Custom Dimensions Display Boxes/Stands Backplanes Dieline 171380
https://cdn.pacdora.com/image-resize/300xauto_outside/preview/mockup-171100.jpg,https://cdn.pacdora.com/image-resize/300xauto_outside/preview/dieline-171100.png,Custom Dimensions Bevel Multifunctional Display Box Display Boxes/Stands Dieline 171100
https://cdn.pacdora.com/image-resize/300xauto_outside/preview/mockup-128050.png,https://cdn.pacdora.com/image-resize/300xauto_outside/preview/dieline-128050.png,Custom Dimensions Tray Boxes Lock Inserts Dieline 128050
https://cdn.pacdora.com/image-resize/300xauto_outside/preview/mockup-150018.jpg,https://cdn.pacdora.com/image-resize/300xauto_outside/preview/dieline-150018.png,Custom Dimensions Flip Top Boxes Mailer Dieline 150018
https://cdn.pacdora.com/image-resize/300xauto_outside/preview/mockup-151040.jpg,https://cdn.pacdora.com/image-resize/300xauto_outside/preview/dieline-151040.png,Custom Dimensions Magnet Box Flip Top Boxes Dieline 151040
https://cdn.pacdora.com/image-resize/300xauto_outside/preview/mockup-171020.jpg,https://cdn.pacdora.com/image-resize/300xauto_outside/preview/dieline-171020.png,Custom Dimensions Display Boxes Auto Lock Bottom Display Dieline 171020
https://cdn.pacdora.com/image-resize/300xauto_outside/preview/mockup-171270.png,https://cdn.pacdora.com/image-resize/300xauto_outside/preview/dieline-171270.png,Custom Dimensions Display Boxes/Stands bevel Dieline 171270
https://cdn.pacdora.com/image-resize/300xauto_outside/preview/mockup-171021.jpg,https://cdn.pacdora.com/image-resize/300xauto_outside/preview/dieline-171021.png,Custom Dimensions Display Boxes Large Open Dieline 171021
https://cdn.pacdora.com/image-resize/300xauto_outside/preview/mockup-170020.jpg,https://cdn.pacdora.com/image-resize/300xauto_outside/preview/dieline-170020.png,Custom Dimensions Display Boxes/Stands Hole Dieline 170020
https://cdn.pacdora.com/image-resize/300xauto_outside/preview/mockup-171051.jpg,https://cdn.pacdora.com/image-resize/300xauto_outside/preview/dieline-171051.png,Custom Dimensions Auto Bottome Snap Lock Boxes Display Dieline 171051
https://cdn.pacdora.com/image-resize/300xauto_outside/preview/mockup-171370.jpg,https://cdn.pacdora.com/image-resize/300xauto_outside/preview/dieline-171370.png,Custom Dimensions Beveled Bottom Display Boxes Dieline 171370
https://cdn.pacdora.com/image-resize/300xauto_outside/preview/mockup-175010.jpg,https://cdn.pacdora.com/image-resize/300xauto_outside/preview/dieline-175010.png,Custom Dimensions Three-tier Display Stands Display Boxes/Stands Dieline 175010
https://cdn.pacdora.com/image-resize/300xauto_outside/preview/mockup-171000.jpg,https://cdn.pacdora.com/image-resize/300xauto_outside/preview/dieline-171000.png,Custom Dimensions Beveled Display Boxes Display /Stands Dieline 171000
https://cdn.pacdora.com/image-resize/300xauto_outside/preview/mockup-310290.jpg,https://cdn.pacdora.com/image-resize/300xauto_outside/preview/dieline-310290.png,Custom Dimensions Inserts/Dividers Positive Dieline 310290
https://cdn.pacdora.com/image-resize/300xauto_outside/preview/mockup-310240.jpg,https://cdn.pacdora.com/image-resize/300xauto_outside/preview/dieline-310240.png,Custom Dimensions Inserts/Dividers Four Sides Dieline 310240
https://cdn.pacdora.com/image-resize/300xauto_outside/preview/mockup-310370.jpg,https://cdn.pacdora.com/image-resize/300xauto_outside/preview/dieline-310370.png,Custom Dimensions Inserts/Dividers Dieline 310370
https://cdn.pacdora.com/image-resize/300xauto_outside/preview/mockup-310230.jpg,https://cdn.pacdora.com/image-resize/300xauto_outside/preview/dieline-310230.png,Custom Dimensions Inserts/Dividers Multifunctional Buffers Dieline 310230
https://cdn.pacdora.com/image-resize/300xauto_outside/preview/mockup-100200.jpg,https://cdn.pacdora.com/image-resize/300xauto_outside/preview/dieline-100200.png,Custom Dimensions Tuck End Boxes Snap Lock Dieline 100200
https://cdn.pacdora.com/image-resize/300xauto_outside/preview/mockup-100020.jpg,https://cdn.pacdora.com/image-resize/300xauto_outside/preview/dieline-100020.png,Custom Dimensions Hook Boxes Double-hook Dieline 100020
https://cdn.pacdora.com/image-resize/300xauto_outside/preview/mockup-112370.jpg,https://cdn.pacdora.com/image-resize/300xauto_outside/preview/dieline-112370.png,Custom Dimensions Roof Boxes Suitcases Dieline 112370
https://cdn.pacdora.com/image-resize/300xauto_outside/preview/mockup-112470.jpg,https://cdn.pacdora.com/image-resize/300xauto_outside/preview/dieline-112470.png,Custom Dimensions Auto Bottome Snap Lock Boxes Flat Top Gift Dieline 112470
https://cdn.pacdora.com/image-resize/300xauto_outside/preview/mockup-260030.jpg,https://cdn.pacdora.com/image-resize/300xauto_outside/preview/dieline-260030.png,Custom Dimensions Business Card Hangtags/Cards Dieline 260030
https://cdn.pacdora.com/image-resize/300xauto_outside/preview/mockup-102030.jpg,https://cdn.pacdora.com/image-resize/300xauto_outside/preview/dieline-102030.png,Custom Dimensions Auto Bottome Snap Lock Boxes Insert Dieline 102030
https://cdn.pacdora.com/image-resize/300xauto_outside/preview/mockup-111610.jpg,https://cdn.pacdora.com/image-resize/300xauto_outside/preview/dieline-111610.png,Custom Dimensions Tuck End Box Variations Handle Dieline 111610
https://cdn.pacdora.com/image-resize/300xauto_outside/preview/mockup-100011.jpg,https://cdn.pacdora.com/image-resize/300xauto_outside/preview/dieline-100011.png,Custom Dimensions Double Tray Boxes Double Door with Auto Locks Dieline 100011
https://cdn.pacdora.com/image-resize/300xauto_outside/preview/mockup-100100.jpg,https://cdn.pacdora.com/image-resize/300xauto_outside/preview/dieline-100100.png,Custom Dimensions Tuck End Boxes Double Tray Dieline 100100
https://cdn.pacdora.com/image-resize/300xauto_outside/preview/mockup-100240.jpg,https://cdn.pacdora.com/image-resize/300xauto_outside/preview/dieline-100240.png,Custom Dimensions Tuck End Boxes Pins Dieline 100240
https://cdn.pacdora.com/image-resize/300xauto_outside/preview/mockup-112030.jpg,https://cdn.pacdora.com/image-resize/300xauto_outside/preview/dieline-112030.png,Custom Dimensions Party Favor Box Gift Box Dieline 112030
https://cdn.pacdora.com/image-resize/300xauto_outside/preview/mockup-100012.jpg,https://cdn.pacdora.com/image-resize/300xauto_outside/preview/dieline-100012.png,Custom Dimensions Tuck End Boxes Lock-top Dieline 100012
https://cdn.pacdora.com/image-resize/300xauto_outside/preview/mockup-220020.jpg,https://cdn.pacdora.com/image-resize/300xauto_outside/preview/dieline-220020.png,Custom Dimensions Tote Bags Auto Bottom Tote Dieline 220020
https://cdn.pacdora.com/image-resize/300xauto_outside/preview/mockup-100230.jpg,https://cdn.pacdora.com/image-resize/300xauto_outside/preview/dieline-100230.png,Custom Dimensions Tuck End Boxes Pins Dieline 100230
https://cdn.pacdora.com/image-resize/300xauto_outside/preview/mockup-161013.jpg,https://cdn.pacdora.com/image-resize/300xauto_outside/preview/dieline-161013.png,Custom Dimensions Boxes with Lid Double Ears Dieline 161013
https://cdn.pacdora.com/image-resize/300xauto_outside/preview/mockup-160022.jpg,https://cdn.pacdora.com/image-resize/300xauto_outside/preview/dieline-160022.png,Custom Dimensions Boxes with Lid Corrugated Cartons Dieline 160022
https://cdn.pacdora.com/image-resize/300xauto_outside/preview/mockup-112340.jpg,https://cdn.pacdora.com/image-resize/300xauto_outside/preview/dieline-112340.png,Custom Dimensions Auto Bottome Snap Lock Boxes 123 Bottom Dieline 112340
https://cdn.pacdora.com/image-resize/300xauto_outside/preview/mockup-100101.jpg,https://cdn.pacdora.com/image-resize/300xauto_outside/preview/dieline-100101.png,Custom Dimensions Lock Insert Boxes Nail Buckles Dieline 100101
https://cdn.pacdora.com/image-resize/300xauto_outside/preview/mockup-220041.jpg,https://cdn.pacdora.com/image-resize/300xauto_outside/preview/dieline-220041.png,Custom Dimensions Tote Bags Arc Holes Dieline 220041
https://cdn.pacdora.com/image-resize/300xauto_outside/preview/mockup-100242.jpg,https://cdn.pacdora.com/image-resize/300xauto_outside/preview/dieline-100242.png,Custom Dimensions Tuck End Boxes With Window Dieline 100242
https://cdn.pacdora.com/image-resize/300xauto_outside/preview/mockup-100243.jpg,https://cdn.pacdora.com/image-resize/300xauto_outside/preview/dieline-100243.png,Custom Dimensions Tuck End Boxes Pins Dieline 100243
https://cdn.pacdora.com/image-resize/300xauto_outside/preview/mockup-112371.jpg,https://cdn.pacdora.com/image-resize/300xauto_outside/preview/dieline-112371.png,Custom Dimensions Reverse Lock Boxes Roof Dieline 112371
https://cdn.pacdora.com/image-resize/300xauto_outside/render/20220210/17447530001.jpg,https://cdn.pacdora.com/image-resize/300xauto_outside/preview/dieline-600070.png,Bag Packaging Flexible Packaging Back-seal Organ Bags Dieline 600070
https://cdn.pacdora.com/image-resize/300xauto_outside/render/20211126/b5c82e91-91c9-4eb7-aaa2-c313afa4281c0001.jpg,https://yun.baoxiaohe.com/admin-materials/8585fdc3-11b3-4f1d-a67d-129e12b885ea.png?imageView2/2/w/300|imageslim,Bottles Plastic Product Label Dieline 504330
https://cdn.pacdora.com/image-resize/300xauto_outside/render/20220317/19380310001.jpg,https://yun.baoxiaohe.com/admin-materials/8e123f9e-686e-4571-a8ac-dd369b320a45.png?imageView2/2/w/300|imageslim,Bottles Plastic Product Label Dieline 507140
https://cdn.pacdora.com/image-resize/300xauto_outside/render/20220209/17431980001.jpg,https://cdn.pacdora.com/image-resize/300xauto_outside/preview/dieline-500450.png,Plastic Bottles Product Label Makeup Dieline 500450
https://cdn.pacdora.com/image-resize/300xauto_outside/render/20220902/32334560001.jpg,https://cdn.pacdora.com/image-resize/300xauto_outside/preview/dieline-510200.png,Paper Cup Black Lid Sleeve Dieline 510200
https://cdn.pacdora.com/image-resize/300xauto_outside/render/20210809/888cdcd9-c88c-4bbd-978f-57bab7df3aa60001.jpg,https://yun.baoxiaohe.com/admin-materials/b12fd080-cadb-4374-9ad6-53ffbf06b76b.png?imageView2/2/w/300|imageslim,Bottles Product Label Dieline 501620
https://cdn.pacdora.com/image-resize/300xauto_outside/admin-materials/9ec15109-c610-4ca7-8236-1d68d76c5a49.png,https://cdn.pacdora.com/image-resize/300xauto_outside/preview/dieline-500790.png,Bottles Paper Cups Dieline 500790
https://cdn.pacdora.com/image-resize/300xauto_outside/render/20220418/22273650001.jpg,https://yun.baoxiaohe.com/admin-materials/4f47bfdc-4bfc-4d68-b9ce-9e970eaf8e94.png?imageView2/2/w/300|imageslim,Flexible Packaging Mylar Bag Sachet Dieline 602830
https://cdn.pacdora.com/image-resize/300xauto_outside/render/20210908/53086773-d4c0-4862-a366-e27b3a3c6dfb0001.jpg,https://yun.baoxiaohe.com/admin-materials/e98a8977-2a2d-4c38-81e7-12d9f02d615b.png?imageView2/2/w/300|imageslim,Plastic Boxes Packaging Sleeve Dieline 502260
https://cdn.pacdora.com/image-resize/300xauto_outside/render/20220210/17455880001.jpg,https://cdn.pacdora.com/image-resize/300xauto_outside/preview/dieline-600140.png,Flexible Packaging Paper Bags Eight Sides Sealing Dieline 600140
https://cdn.pacdora.com/image-resize/300xauto_outside/render/20220511/24423610001.jpg,https://cdn.pacdora.com/image-resize/300xauto_outside/preview/dieline-602960.png,Plastic Boxes Flexible Packaging Sleeve Dieline 602960
https://cdn.pacdora.com/image-resize/300xauto_outside/render/20220210/17456540001.jpg,https://cdn.pacdora.com/image-resize/300xauto_outside/preview/dieline-600150.png,Standing Pouch Bag Packaging Flexible Packaging Dieline 600150
https://cdn.pacdora.com/image-resize/300xauto_outside/render/20220210/17467690001.jpg,https://cdn.pacdora.com/image-resize/300xauto_outside/preview/dieline-600340.png,Bag Packaging Flexible Packaging Eight Sides Sealing Plastic Bags Dieline 600340
https://cdn.pacdora.com/image-resize/300xauto_outside/render/20220122/17164200001.jpg,https://yun.baoxiaohe.com/admin-materials/410f6247-4ec1-4e70-83eb-d2763fb4540a.png?imageView2/2/w/300|imageslim,Tote Bags Paper Gift Dieline 610040
https://cdn.pacdora.com/image-resize/300xauto_outside/preview/mockup-150120.png,https://cdn.pacdora.com/image-resize/300xauto_outside/preview/dieline-150120.png,Custom Dimensions Sleeve Box Tuck Front Box Dieline 150120
https://cdn.pacdora.com/image-resize/300xauto_outside/render/20220317/19434610001.jpg,https://yun.baoxiaohe.com/admin-materials/9c871b40-4bed-4465-91ea-30367b24832a.png?imageView2/2/w/300|imageslim,Tote Bags Pape Gift Dieline 610030
https://cdn.pacdora.com/image-resize/300xauto_outside/preview/mockup-128032.jpg,https://cdn.pacdora.com/image-resize/300xauto_outside/preview/dieline-128032.png,Custom Dimensions Tray Boxes Double-layer Envelopes Dieline 128032
